{
  "version": 1,
  "adsb": {
    "typeCode": 3,
    "aircraftCategory": 4,
    "categoryText": "Ultralight / hang-glider / paraglider"
  },
  "aliasOf": null,
  "render": {
    "scale": 1,
    "anchor": { "x": 35, "y": 31 },
    "noRotate": false
  },
  "art": {
    "frames": [
      { "src": "silhouettes/Hang_Glider.svg" }
    ],
    "frameTime": null
  },
  "notes": "Map to generic hang glider."
}
