{
  "version": 1,
  "adsb": {
    "typeCode": 2,
    "aircraftCategory": 2,
    "categoryText": "Surface service vehicle"
  },
  "aliasOf": null,
  "render": {
    "scale": 1,
    "anchor": { "x": 35, "y": 35 },
    "noRotate": false
  },
  "art": {
    "frames": [
      { "src": "silhouettes/Airport_Baggage_Tug.svg" }
    ],
    "frameTime": null
  },
  "notes": "Map to Airport Baggage Tug."
}
